,title,pub_date,authors,abstract,FTURL
19,Does Link Prediction Help Detect Feature Interactions in Software Product Lines (SPLs)?,2020-09-15,"['Khoshmanesh, Seyedehzahra', 'Lutz, Robyn']","An ongoing challenge for the requirements engineering of software product
lines is to predict whether a new combination of features (units of
functionality) will create an unwanted or even hazardous feature interaction.
We thus seek to improve and automate the prediction of unwanted feature
interactions early in development. In this paper, we show how the detection of
unwanted feature interactions in a software product line can be effectively
represented as a link prediction problem. Link prediction uses machine learning
algorithms and similarity scores among a graph's nodes to identify likely new
edges. We here model the software product line features as nodes and the
unwanted interactions among the features as edges. We investigate six
link-based similarity metrics, some using local and some using global knowledge
of the graph, for use in this context. We evaluate our approach on a software
product line benchmark in the literature, building six machine-learning models
from the graph-based similarity data. Results show that the best ML algorithms
achieved an accuracy of 0.75 to 1 for classifying feature interactions as
unwanted or wanted in this small study and that global similarity metrics
performed better than local similarity metrics. The work shows how
link-prediction models can help find missing edges, which represent unwanted
feature interactions that are undocumented or unrecognized, earlier in
development.",http://arxiv.org/pdf/2009.07392.pdf
20,Pardon the Interruption: An Analysis of Gender and Turn-Taking in U.S. Supreme Court Oral Arguments,2020-09-15,"['Lepp, Haley', 'Levow, Gina-Anne']","This study presents a corpus of turn changes between speakers in U.S. Supreme
Court oral arguments. Each turn change is labeled on a spectrum of
""cooperative"" to ""competitive"" by a human annotator with legal experience in
the United States. We analyze the relationship between speech features, the
nature of exchanges, and the gender and legal role of the speakers. Finally, we
demonstrate that the models can be used to predict the label of an exchange
with moderate success. The automatic classification of the nature of exchanges
indicates that future studies of turn-taking in oral arguments can rely on
larger, unlabeled corpora.",http://arxiv.org/pdf/2009.07391.pdf
21,Creation and Validation of a Chest X-Ray Dataset with Eye-tracking and Report Dictation for AI Tool Development,2020-09-15,"['Karargyris, Alexandros', 'Kashyap, Satyananda', 'Lourentzou, Ismini', 'Wu, Joy', 'Sharma, Arjun', 'Tong, Matthew', 'Abedin, Shafiq', 'Beymer, David', 'Mukherjee, Vandana', 'A, Elizabeth', 'Moradi, Mehdi']","We developed a rich dataset of Chest X-Ray (CXR) images to assist
investigators in artificial intelligence. The data were collected using an eye
tracking system while a radiologist reviewed and reported on 1,083 CXR images.
The dataset contains the following aligned data: CXR image, transcribed
radiology report text, radiologist's dictation audio and eye gaze coordinates
data. We hope this dataset can contribute to various areas of research
particularly towards explainable and multimodal deep learning / machine
learning methods. Furthermore, investigators in disease classification and
localization, automated radiology report generation, and human-machine
interaction can benefit from these data. We report deep learning experiments
that utilize the attention maps produced by eye gaze dataset to show the
potential utility of this data.",http://arxiv.org/pdf/2009.07386.pdf
